{"schema_id":"https://weflow.local/contracts/v1/evaluation-task.schema.json","schema_version":"v1","tenant_id":"tenant-alpha","suite_id":"offline-seed.v1","evaluation_task_id":"investigation-candidate-recovery","fixture_id":"api-503-investigation-candidate-recovery","fixture_sha256":"7777777777777777777777777777777777777777777777777777777777777777","policy_sha256":"aaaaaaaaaaaaaaaaaaaaaaaaaaaaaaaaaaaaaaaaaaaaaaaaaaaaaaaaaaaaaaaa","execution_adapter":"investigation-agent","fault_profile_id":"candidate","created_at":"2026-08-05T00:00:00Z"}
