{"schema_id":"https://weflow.local/contracts/v1/evaluation-task.schema.json","schema_version":"v1","tenant_id":"tenant-alpha","suite_id":"offline-seed.v1","evaluation_task_id":"workflow-sla-expiry","fixture_id":"api-503-sla-expiry","fixture_sha256":"5555555555555555555555555555555555555555555555555555555555555555","policy_sha256":"aaaaaaaaaaaaaaaaaaaaaaaaaaaaaaaaaaaaaaaaaaaaaaaaaaaaaaaaaaaaaaaa","execution_adapter":"durable-workflow","created_at":"2026-08-05T00:00:00Z"}
