{"schema_id":"https://weflow.local/contracts/v1/evaluation-task.schema.json","schema_version":"v1","tenant_id":"tenant-alpha","suite_id":"offline-seed.v1","evaluation_task_id":"policy-revoked-grant","fixture_id":"api-503-policy-revoked-grant","fixture_sha256":"bbbbbbbbbbbbbbbbbbbbbbbbbbbbbbbbbbbbbbbbbbbbbbbbbbbbbbbbbbbbbbbb","policy_sha256":"aaaaaaaaaaaaaaaaaaaaaaaaaaaaaaaaaaaaaaaaaaaaaaaaaaaaaaaaaaaaaaaa","execution_adapter":"policy-approval","created_at":"2026-08-05T00:00:00Z"}
