{"schema_id":"https://weflow.local/contracts/v1/evaluation-task.schema.json","schema_version":"v1","tenant_id":"tenant-alpha","suite_id":"offline-seed.v1","evaluation_task_id":"policy-delivery-recovery","fixture_id":"api-503-policy-delivery-lost-response","fixture_sha256":"9999999999999999999999999999999999999999999999999999999999999999","policy_sha256":"aaaaaaaaaaaaaaaaaaaaaaaaaaaaaaaaaaaaaaaaaaaaaaaaaaaaaaaaaaaaaaaa","execution_adapter":"policy-approval","fault_profile_id":"delivery-lost-response","created_at":"2026-08-05T00:00:00Z"}
